Index,Title,Author,Upvotes,Comments,URL,Post Text
1,"I'm 100% self taught, landed my first job! My experience!",JLaurus,3630,385,https://www.reddit.com/r/learnpython/comments/ctkypf/im_100_self_taught_landed_my_first_job_my/,"Hi all, 

Firstly this is going to be a long post to hopefully help people genuinely looking to commit to becoming a developer by sharing my story of how I went from absolutely zero knowledge of progr..."
2,I solved a real life problem with python for the 1st time and I feel like a wizard,[deleted],2688,202,https://www.reddit.com/r/learnpython/comments/xy1swx/i_solved_a_real_life_problem_with_python_for_the/,"Okay, this is probably going to sound super dumb, but today I'm putting the finishing touches on a program that downloads a data file for me (into a folder of my choosing!!! this part tripped me up fo..."
3,"The online course for ""Automate the Boring Stuff with Python"" is free to sign up this week.",AlSweigart,2320,237,https://www.reddit.com/r/learnpython/comments/bz3rxv/the_online_course_for_automate_the_boring_stuff/,"School's out, but that doesn't mean you have to stop learning. The online video course from the author of ""Automate the Boring Stuff with Python"" (that's me) is free to sign up for this week. This sig..."
4,"As a Gift to the Community, I'm Making my Python Book Free for 72 hours!",driscollis,2166,277,https://www.reddit.com/r/learnpython/comments/kv61rj/as_a_gift_to_the_community_im_making_my_python/,**Python 101 2nd Edition** is the latest version of Python 101. This book is meant to help you learn Python and then go beyond the basics. I've always felt that a beginner's book should teach more tha...
5,Python is a godsend for work,MyManagerIsAnIdiot,2091,160,https://www.reddit.com/r/learnpython/comments/1h8ljhc/python_is_a_godsend_for_work/,I wanted to just thank the community for everything here.  Its a real tool to have in your arsenal when things get tough.  Today was the first day I put it into use and it was all due to lurking aroun...
6,"""Automate the Boring Stuff with Python"" Udemy course free to sign up until May 7th.",AlSweigart,2073,164,https://www.reddit.com/r/learnpython/comments/gbp0a1/automate_the_boring_stuff_with_python_udemy/,"https://inventwithpython.com/automateudemy (This link will automatically redirect you to the latest discount code.)

You can also click this link or manually enter the code: MAY2020FREE (on Monday the..."
7,"After 5 years of learning Python as a hobby, yesterday I did my first contribution to an open source project!",marcovirtual,1983,60,https://www.reddit.com/r/learnpython/comments/he7vpy/after_5_years_of_learning_python_as_a_hobby/,"About 5 years ago I started to study programming on and off as a hobby. I love reading articles, posts and books about Python and AutoHotKey, and during these years I have done some webscraping projec..."
8,"""Automate the Boring Stuff with Python"" online course is free to sign up for the next few days with code JUN2020FREE",AlSweigart,1826,127,https://www.reddit.com/r/learnpython/comments/guu0nq/automate_the_boring_stuff_with_python_online/,"EDIT: Whoops, sorry, I've been... busy... the last few days. I just made the JUN2020FREE2 code, but it might take an hour or so to take effect. They'll show you the $16 ""discount"" using the link until..."
9,Beginner's Python Cheat Sheets (updated),ehmatthes,1781,127,https://www.reddit.com/r/learnpython/comments/djqm6v/beginners_python_cheat_sheets_updated/,Hi everyone! A few years ago I made a set of cheat sheets to go along with the first edition of Python Crash Course. I recently finished updating the cheat sheets to match the changes that were made t...
10,Automate the Boring Stuff with Python Udemy course free to sign up until April 7th.,AlSweigart,1746,146,https://www.reddit.com/r/learnpython/comments/ft8tv2/automate_the_boring_stuff_with_python_udemy/,"https://inventwithpython.com/automateudemy (This link will automatically redirect you to the latest discount code.)

[(EDIT: The HTML book is free online, but you can get the PDF/Kindle ebook of Autom..."
